{"dsl_version":"1","edges":[{"activation":{"kind":"route","route":"http_route"},"id":"xe_501afa5d0be1df08cb6d7eb2","source_node_id":"xn_d1d1f62c10f03d3e24da4112","target_node_id":"xn_c3f8fedb1b8f6e85af20008f"},{"activation":{"kind":"always"},"id":"xe_510074657b6e209636cea898","source_node_id":"xn_effb58806a10aa870dfb9441","target_node_id":"xn_d1d1f62c10f03d3e24da4112"},{"activation":{"kind":"always"},"id":"xe_54fddcee1c746abcb1027fb0","source_node_id":"xn_9437d7ed93412b1e96426edf","target_node_id":"xn_28ab1668f6c71acdd9d628e0"},{"activation":{"kind":"route","route":"rpc_route"},"id":"xe_bfd2c52ff8003b5ac47b96fc","source_node_id":"xn_d1d1f62c10f03d3e24da4112","target_node_id":"xn_9437d7ed93412b1e96426edf"},{"activation":{"kind":"always"},"id":"xe_d09f4f20c6d873b86ab4098d","source_node_id":"xn_6c706ae5e194a43dd36e4333","target_node_id":"xn_effb58806a10aa870dfb9441"},{"activation":{"kind":"always"},"id":"xe_d78396ceca91f333a1a827a3","source_node_id":"xn_28ab1668f6c71acdd9d628e0","target_node_id":"xn_2d5dd88597f16d2191c1187d"},{"activation":{"kind":"always"},"id":"xe_e7786901abd66aec0353c640","source_node_id":"xn_c3f8fedb1b8f6e85af20008f","target_node_id":"xn_28ab1668f6c71acdd9d628e0"}],"entry_node_id":"xn_6c706ae5e194a43dd36e4333","exit_node_id":"xn_2d5dd88597f16d2191c1187d","nodes":[{"execution_policy":{"attempt_timeout_ms":30000,"max_attempts":1,"max_recoveries":3,"retry_backoff":{"delay_ms":1000,"kind":"fixed"}},"id":"xn_28ab1668f6c71acdd9d628e0","inputs":{},"kind":"task","operation":{"config":{"sandbox_profile":"python-sandbox-v1","source_code":"def main(inputs):\n    return {'result': {'completed': True}}"},"type":"task.python","version":1},"outputs":{"result":"object"}},{"execution_policy":{},"id":"xn_2d5dd88597f16d2191c1187d","inputs":{"workflow_output":{"data_type":"object","kind":"node_output","output":{"name":"result","node_id":"xn_28ab1668f6c71acdd9d628e0"}}},"kind":"control","operation":{"config":{},"type":"control.end","version":1},"outputs":{}},{"execution_policy":{},"id":"xn_6c706ae5e194a43dd36e4333","inputs":{},"kind":"control","operation":{"config":{},"type":"control.start","version":1},"outputs":{"workflow_input":"object"}},{"execution_policy":{"attempt_timeout_ms":30000,"max_attempts":1,"max_recoveries":3,"retry_backoff":{"delay_ms":1000,"kind":"fixed"}},"id":"xn_9437d7ed93412b1e96426edf","inputs":{"request":{"data_type":"object","kind":"node_output","output":{"name":"payload","node_id":"xn_effb58806a10aa870dfb9441"}}},"kind":"task","operation":{"config":{"contract_revision":"contract-7","idempotent":true,"operation":"CreateOrder","service_id":"svc_018f_order"},"type":"task.rpc","version":1},"outputs":{"response":"object"}},{"execution_policy":{"attempt_timeout_ms":30000,"max_attempts":1,"max_recoveries":3,"retry_backoff":{"delay_ms":1000,"kind":"fixed"}},"id":"xn_c3f8fedb1b8f6e85af20008f","inputs":{"body":{"data_type":"object","kind":"node_output","output":{"name":"payload","node_id":"xn_effb58806a10aa870dfb9441"}},"relative_path":{"data_type":"string","kind":"literal","value":"/v1/orders"}},"kind":"task","operation":{"config":{"accepted_statuses":[200,201],"connection_id":"conn_018f_customer","method":"POST"},"type":"task.http","version":1},"outputs":{"response":"object"}},{"execution_policy":{},"id":"xn_d1d1f62c10f03d3e24da4112","inputs":{"value":{"data_type":"integer","kind":"node_output","output":{"name":"score","node_id":"xn_effb58806a10aa870dfb9441"}}},"kind":"control","operation":{"config":{"cases":[{"operator":"gte","route":"http_route","value":80}],"default_route":"rpc_route"},"type":"control.branch","version":1},"outputs":{}},{"execution_policy":{"attempt_timeout_ms":30000,"max_attempts":1,"max_recoveries":3,"retry_backoff":{"delay_ms":1000,"kind":"fixed"}},"id":"xn_effb58806a10aa870dfb9441","inputs":{"request":{"data_type":"object","kind":"node_output","output":{"name":"workflow_input","node_id":"xn_6c706ae5e194a43dd36e4333"}}},"kind":"task","operation":{"config":{"sandbox_profile":"python-sandbox-v1","source_code":"def main(inputs):\n    return {'score': 85, 'payload': inputs['request']}"},"type":"task.python","version":1},"outputs":{"payload":"object","score":"integer"}}]}
